<?xml version="1.0" encoding="UTF-8"?>
<!--

    Copyright 2004-2016 the original author or authors.

    Licensed under the Apache License, Version 2.0 (the "License");
    you may not use this file except in compliance with the License.
    You may obtain a copy of the License at

       http://www.apache.org/licenses/LICENSE-2.0

    Unless required by applicable law or agreed to in writing, software
    distributed under the License is distributed on an "AS IS" BASIS,
    WITHOUT WARRANTIES OR CONDITIONS OF ANY KIND, either express or implied.
    See the License for the specific language governing permissions and
    limitations under the License.

-->
<!DOCTYPE sqlMapConfig PUBLIC
    "-//iBATIS.com//DTD SQL Map Config 2.0//EN"
    "http://www.ibatis.com/dtd/sql-map-config-2.dtd">

<sqlMapConfig>
  <properties resource="com/ibatis/sqlmap/maps/SqlMapConfig.properties"/>

  <transactionManager type="JDBC" >
    <dataSource type="SIMPLE">
      <property name="JDBC.Driver" value="${driver}"/>
      <property name="JDBC.ConnectionURL" value="${url}"/>
      <property name="JDBC.Username" value="${username}"/>
      <property name="JDBC.Password" value="${password}"/>
    </dataSource>
  </transactionManager>

  <sqlMap resource="threads/Foo-sql-map.xml" />

</sqlMapConfig>
